{
  "schema_version": 1,
  "id": "standard",
  "name": "Standard Human Approval",
  "description": "Least-privilege approval policy for agent work. Unknown operations ask by default; explicit denies cannot be weakened by repository policy or delegated agents.",
  "default_decision": "ask",
  "unmet_requirement_decision": "ask",
  "precedence": ["deny", "ask", "allow"],
  "grant_policy": {
    "reviewer": "human",
    "model_review": false,
    "delegable": false,
    "default_ttl_seconds": 900,
    "max_ttl_seconds": 3600,
    "default_max_uses": 1,
    "bind_to": ["operation", "target", "repository", "worktree", "task", "policy_digest"],
    "invalidate_on": [
      "operation_change",
      "target_change",
      "repository_change",
      "worktree_change",
      "task_change",
      "scope_change",
      "policy_change",
      "timeout",
      "use_limit"
    ],
    "record": true
  },
  "rules": [
    {
      "id": "workspace-discovery",
      "description": "Allow non-sensitive reads and repository inspection inside a trusted workspace.",
      "operations": [
        "filesystem.read",
        "repository.read",
        "repository.status",
        "configuration.inspect"
      ],
      "decision": "allow",
      "risk": "low",
      "requirements": ["trusted_repository", "inside_workspace", "non_sensitive_target"]
    },
    {
      "id": "public-research",
      "description": "Allow read-only public documentation and web research without authentication or external mutation.",
      "operations": ["documentation.search", "web.search"],
      "decision": "allow",
      "risk": "low",
      "requirements": ["public_source_only", "no_authentication"]
    },
    {
      "id": "local-verification",
      "description": "Allow repository-declared deterministic checks inside the workspace without network access.",
      "operations": [
        "repository.format",
        "repository.lint",
        "repository.typecheck",
        "repository.test",
        "repository.build"
      ],
      "decision": "allow",
      "risk": "low",
      "requirements": [
        "trusted_repository",
        "inside_workspace",
        "repository_declared_command",
        "network_disabled"
      ]
    },
    {
      "id": "approved-workspace-change",
      "description": "Allow workspace edits only after the human-approved task scope or handoff is recorded.",
      "operations": ["filesystem.workspace_write", "repository.modify"],
      "decision": "allow",
      "risk": "medium",
      "requirements": ["approved_task_scope", "inside_workspace", "non_sensitive_target"]
    },
    {
      "id": "local-agent-state",
      "description": "Allow bounded local status and metrics records that exclude prompts, outputs, credentials, and secrets.",
      "operations": ["maisternia.state_write", "maisternia.metrics_write"],
      "decision": "allow",
      "risk": "low",
      "requirements": ["redacted_record", "local_only"]
    },
    {
      "id": "read-only-delegation",
      "description": "Allow bounded read-only delegation when provider, authority, budget, task boundary, and output are explicit.",
      "operations": ["delegation.read_only"],
      "decision": "allow",
      "risk": "low",
      "requirements": ["delegation_contract", "bounded_budget"]
    },
    {
      "id": "implementation-gate",
      "description": "Require human approval to begin implementation or expand an already approved task scope.",
      "operations": ["implementation.begin", "workspace.scope_expand"],
      "decision": "ask",
      "risk": "medium",
      "requirements": ["human_present"],
      "approval": {
        "scope": "task",
        "ttl_seconds": 3600,
        "max_uses": 1000,
        "require_preview": true,
        "require_reason": true
      }
    },
    {
      "id": "permission-escalation",
      "description": "Require a fresh decision for broader filesystem, MCP, sandbox, or tool authority.",
      "operations": [
        "permission.escalate",
        "filesystem.outside_workspace",
        "mcp.enable",
        "sandbox.weaken",
        "tool.enable_privileged"
      ],
      "decision": "ask",
      "risk": "high",
      "requirements": ["human_present"],
      "approval": {
        "scope": "once",
        "ttl_seconds": 300,
        "max_uses": 1,
        "require_preview": true,
        "require_reason": true
      }
    },
    {
      "id": "bounded-network-access",
      "description": "Allow one reviewed task-bound grant to reuse network access for the approved target and task.",
      "operations": ["network.access"],
      "decision": "ask",
      "risk": "high",
      "requirements": ["human_present"],
      "approval": {
        "scope": "task",
        "ttl_seconds": 900,
        "max_uses": 20,
        "require_preview": true,
        "require_reason": true
      }
    },
    {
      "id": "secret-access",
      "description": "Require a fresh decision before reading a secret.",
      "operations": ["secret.read"],
      "decision": "ask",
      "risk": "high",
      "requirements": ["human_present"],
      "approval": {
        "scope": "once",
        "ttl_seconds": 300,
        "max_uses": 1,
        "require_preview": true,
        "require_reason": true
      }
    },
    {
      "id": "credential-use",
      "description": "Allow one reviewed task-bound grant to reuse a credential for the approved operation and target without exposing it.",
      "operations": ["credential.use"],
      "decision": "ask",
      "risk": "high",
      "requirements": ["human_present"],
      "approval": {
        "scope": "task",
        "ttl_seconds": 900,
        "max_uses": 20,
        "require_preview": true,
        "require_reason": true
      }
    },
    {
      "id": "supply-chain-change",
      "description": "Require review before changing dependencies, executable hooks, security policy, CI, or persistent agent configuration.",
      "operations": [
        "dependency.add",
        "dependency.update",
        "hook.activate",
        "configuration.security_change",
        "ci.modify",
        "agent.configuration_modify"
      ],
      "decision": "ask",
      "risk": "high",
      "requirements": ["human_present"],
      "approval": {
        "scope": "once",
        "ttl_seconds": 900,
        "max_uses": 1,
        "require_preview": true,
        "require_reason": true
      }
    },
    {
      "id": "local-git-record",
      "description": "Allow local commits for the approved task inside the trusted workspace; publication remains separately gated.",
      "operations": ["git.commit"],
      "decision": "allow",
      "risk": "medium",
      "requirements": ["approved_task_scope", "trusted_repository", "inside_workspace"]
    },
    {
      "id": "git-publication",
      "description": "Require one exact publication checkpoint before task-bound pushes and pull-request mutations.",
      "operations": ["git.push", "pull_request.create", "pull_request.update"],
      "decision": "ask",
      "risk": "high",
      "requirements": ["human_present"],
      "approval": {
        "scope": "task",
        "ttl_seconds": 900,
        "max_uses": 20,
        "require_preview": true,
        "require_reason": true
      }
    },
    {
      "id": "external-write",
      "description": "Require an exact-target decision before changing tickets, messages, APIs, or other external systems.",
      "operations": ["issue.update", "external.write", "notification.send", "deploy.preview"],
      "decision": "ask",
      "risk": "high",
      "requirements": ["human_present"],
      "approval": {
        "scope": "once",
        "ttl_seconds": 600,
        "max_uses": 1,
        "require_preview": true,
        "require_reason": true
      }
    },
    {
      "id": "destructive-local-change",
      "description": "Require a fresh decision for bounded destructive operations inside the approved workspace.",
      "operations": [
        "filesystem.delete",
        "git.destructive",
        "migration.destructive",
        "cleanup.destructive"
      ],
      "decision": "ask",
      "risk": "critical",
      "requirements": ["human_present", "inside_workspace"],
      "approval": {
        "scope": "once",
        "ttl_seconds": 300,
        "max_uses": 1,
        "require_preview": true,
        "require_reason": true
      }
    },
    {
      "id": "docker-cleanup-destructive",
      "description": "Require a fresh exact-target decision for task-owned cleanup on a local non-production Docker engine.",
      "operations": [
        "docker.container.stop",
        "docker.container.remove",
        "docker.network.remove",
        "docker.volume.remove",
        "docker.image.remove"
      ],
      "decision": "ask",
      "risk": "critical",
      "requirements": [
        "human_present",
        "approved_task_scope",
        "trusted_repository",
        "non_sensitive_target"
      ],
      "approval": {
        "scope": "once",
        "ttl_seconds": 300,
        "max_uses": 1,
        "require_preview": true,
        "require_reason": true
      }
    },
    {
      "id": "machine-cleanup-destructive",
      "description": "Require a fresh bounded native-manager decision for local machine cleanup; never authorize arbitrary host filesystem deletion.",
      "operations": [
        "host.cache.prune",
        "host.cache.clear",
        "host.docker.image.remove",
        "host.docker.build_cache.prune",
        "host.docker.backend.compact",
        "host.trash.empty",
        "host.log.prune"
      ],
      "decision": "ask",
      "risk": "critical",
      "requirements": ["human_present", "approved_task_scope", "local_only", "bounded_budget", "redacted_record"],
      "approval": {
        "scope": "once",
        "ttl_seconds": 300,
        "max_uses": 1,
        "require_preview": true,
        "require_reason": true
      }
    },
    {
      "id": "machine-cleanup-stateful",